{
  "id": "P8",
  "name": "Public Service and Field",
  "atsTier": "A",
  "status": "finished",
  "twin": null,
  "rtlVariant": true,
  "layout": {
    "kind": "single",
    "header": "plain",
    "headingCase": "upper",
    "headingStyle": "rule-below",
    "bulletStyle": "disc",
    "dateAlign": "end",
    "sectionOrder": [
      "summary",
      "highlights",
      "work",
      "education",
      "certificates",
      "languages",
      "skills",
      "projects",
      "volunteer",
      "publications"
    ]
  },
  "fonts": {
    "display": {
      "latin": "Inter",
      "arabic": "IBM Plex Sans Arabic",
      "weight": 700
    },
    "heading": {
      "latin": "Inter",
      "arabic": "IBM Plex Sans Arabic",
      "weight": 700
    },
    "body": {
      "latin": "Inter",
      "arabic": "IBM Plex Sans Arabic",
      "weight": 400
    },
    "mono": {
      "latin": "IBM Plex Mono",
      "arabic": "IBM Plex Sans Arabic",
      "weight": 400
    }
  },
  "colors": {
    "bg": "#ffffff",
    "text": "#111111",
    "muted": "#3d3d3d",
    "accent": "#111111",
    "rule": "#6b6b6b"
  },
  "sizes": {
    "page": "A4",
    "base": 10.5,
    "name": 22,
    "headline": 12,
    "heading": 11,
    "small": 9,
    "lineHeight": 1.45,
    "arabicLineHeight": 1.62,
    "marginTop": 16,
    "marginSide": 20,
    "marginBottom": 16
  },
  "spacing": {
    "section": 14,
    "item": 9,
    "bullet": 2.4,
    "gutter": 0
  },
  "limits": {
    "maxPages": 2
  }
}
