{
  "id": "C9",
  "name": "Sidebar Light",
  "atsTier": "C",
  "status": "finished",
  "twin": "P1",
  "rtlVariant": true,
  "layout": {
    "kind": "sidebar",
    "header": "plain",
    "sidebarWidth": "54mm",
    "sidebarSections": [
      "contact",
      "skills",
      "languages",
      "certificates"
    ],
    "headingCase": "none",
    "headingStyle": "rule-below",
    "bulletStyle": "disc",
    "dateAlign": "end",
    "sectionOrder": [
      "summary",
      "highlights",
      "work",
      "projects",
      "education",
      "volunteer",
      "publications",
      "skills",
      "certificates",
      "languages"
    ]
  },
  "fonts": {
    "display": {
      "latin": "Inter",
      "arabic": "IBM Plex Sans Arabic",
      "weight": 700
    },
    "heading": {
      "latin": "Inter",
      "arabic": "IBM Plex Sans Arabic",
      "weight": 600
    },
    "body": {
      "latin": "Inter",
      "arabic": "IBM Plex Sans Arabic",
      "weight": 400
    },
    "mono": {
      "latin": "IBM Plex Mono",
      "arabic": "IBM Plex Sans Arabic",
      "weight": 400
    }
  },
  "colors": {
    "bg": "#ffffff",
    "text": "#16202a",
    "muted": "#4b5864",
    "accent": "#1f4e79",
    "rule": "#7b8a98",
    "sidebarBg": "#e9eef3",
    "sidebarText": "#16202a",
    "sidebarMuted": "#42505c",
    "sidebarAccent": "#1f4e79"
  },
  "sizes": {
    "page": "A4",
    "base": 10,
    "name": 24,
    "headline": 12,
    "heading": 11,
    "small": 9,
    "lineHeight": 1.4,
    "arabicLineHeight": 1.62,
    "marginTop": 14,
    "marginSide": 13,
    "marginBottom": 14
  },
  "spacing": {
    "section": 14,
    "item": 8,
    "bullet": 1.8,
    "gutter": 8
  },
  "limits": {
    "maxPages": 2
  }
}
