{
  "id": "C1",
  "name": "Accent Band",
  "atsTier": "B",
  "status": "finished",
  "twin": null,
  "rtlVariant": true,
  "layout": {
    "kind": "single",
    "header": "band",
    "headingCase": "upper",
    "headingStyle": "rule-below",
    "bulletStyle": "disc",
    "dateAlign": "end",
    "sectionOrder": [
      "summary",
      "highlights",
      "work",
      "projects",
      "education",
      "volunteer",
      "publications",
      "skills",
      "certificates",
      "languages"
    ]
  },
  "fonts": {
    "display": {
      "latin": "Inter",
      "arabic": "IBM Plex Sans Arabic",
      "weight": 700
    },
    "heading": {
      "latin": "Inter",
      "arabic": "IBM Plex Sans Arabic",
      "weight": 700
    },
    "body": {
      "latin": "Inter",
      "arabic": "IBM Plex Sans Arabic",
      "weight": 400
    },
    "mono": {
      "latin": "IBM Plex Mono",
      "arabic": "IBM Plex Sans Arabic",
      "weight": 400
    }
  },
  "colors": {
    "bg": "#ffffff",
    "text": "#17212b",
    "muted": "#4a5663",
    "accent": "#1f3a5f",
    "rule": "#6b7a8c",
    "bandBg": "#1f3a5f",
    "bandText": "#ffffff"
  },
  "sizes": {
    "page": "A4",
    "base": 10,
    "name": 26,
    "headline": 12,
    "heading": 10.5,
    "small": 9,
    "lineHeight": 1.4,
    "arabicLineHeight": 1.62,
    "marginTop": 14,
    "marginSide": 18,
    "marginBottom": 14
  },
  "spacing": {
    "section": 14,
    "item": 8,
    "bullet": 1.8,
    "gutter": 0
  },
  "limits": {
    "maxPages": 2
  }
}
