{
  "id": "P2",
  "name": "Modern Minimal",
  "atsTier": "A",
  "status": "finished",
  "twin": null,
  "rtlVariant": true,
  "layout": {
    "kind": "single",
    "header": "plain",
    "headingCase": "none",
    "headingStyle": "plain",
    "bulletStyle": "dash",
    "dateAlign": "end",
    "sectionOrder": [
      "summary",
      "highlights",
      "work",
      "projects",
      "education",
      "volunteer",
      "publications",
      "skills",
      "certificates",
      "languages"
    ]
  },
  "fonts": {
    "display": {
      "latin": "Inter",
      "arabic": "IBM Plex Sans Arabic",
      "weight": 600
    },
    "heading": {
      "latin": "Inter",
      "arabic": "IBM Plex Sans Arabic",
      "weight": 600
    },
    "body": {
      "latin": "Inter",
      "arabic": "IBM Plex Sans Arabic",
      "weight": 400
    },
    "mono": {
      "latin": "IBM Plex Mono",
      "arabic": "IBM Plex Sans Arabic",
      "weight": 400
    }
  },
  "colors": {
    "bg": "#ffffff",
    "text": "#1b1b1b",
    "muted": "#595959",
    "accent": "#1b1b1b",
    "rule": "#8c8c8c"
  },
  "sizes": {
    "page": "A4",
    "base": 10,
    "name": 26,
    "headline": 12,
    "heading": 10.5,
    "small": 9,
    "lineHeight": 1.42,
    "arabicLineHeight": 1.62,
    "marginTop": 18,
    "marginSide": 20,
    "marginBottom": 16
  },
  "spacing": {
    "section": 15,
    "item": 8.5,
    "bullet": 2,
    "gutter": 0
  },
  "limits": {
    "maxPages": 2
  }
}
