{
  "id": "C3",
  "name": "Bold Type",
  "atsTier": "B",
  "status": "finished",
  "twin": null,
  "rtlVariant": true,
  "layout": {
    "kind": "single",
    "header": "plain",
    "headingCase": "upper",
    "headingStyle": "plain",
    "bulletStyle": "disc",
    "dateAlign": "end",
    "sectionOrder": [
      "summary",
      "highlights",
      "work",
      "projects",
      "education",
      "volunteer",
      "publications",
      "skills",
      "certificates",
      "languages"
    ]
  },
  "fonts": {
    "display": {
      "latin": "Inter",
      "arabic": "IBM Plex Sans Arabic",
      "weight": 700
    },
    "heading": {
      "latin": "Inter",
      "arabic": "IBM Plex Sans Arabic",
      "weight": 700
    },
    "body": {
      "latin": "Inter",
      "arabic": "IBM Plex Sans Arabic",
      "weight": 400
    },
    "mono": {
      "latin": "IBM Plex Mono",
      "arabic": "IBM Plex Sans Arabic",
      "weight": 400
    }
  },
  "colors": {
    "bg": "#ffffff",
    "text": "#111111",
    "muted": "#4a4a4a",
    "accent": "#b3261e",
    "rule": "#767676"
  },
  "sizes": {
    "page": "A4",
    "base": 10,
    "name": 34,
    "headline": 13,
    "heading": 12,
    "small": 9,
    "lineHeight": 1.4,
    "arabicLineHeight": 1.62,
    "marginTop": 16,
    "marginSide": 18,
    "marginBottom": 16
  },
  "spacing": {
    "section": 16,
    "item": 9,
    "bullet": 1.8,
    "gutter": 0
  },
  "limits": {
    "maxPages": 2
  }
}
